{
  "schema": "ai_teaching_student_workspace_view/v3",
  "session_id": "TS-4242",
  "revision": 6,
  "canvas": {
    "elements": [
      {
        "element_id": "seg-AD",
        "kind": "segment",
        "visible": true,
        "highlighted": true
      },
      {
        "element_id": "seg-BC",
        "kind": "segment",
        "visible": true
      },
      {
        "element_id": "label-DE",
        "kind": "label",
        "visible": true,
        "student_authored": true
      }
    ],
    "interaction_enabled": true,
    "visual": {
      "visual_revision": 0,
      "annotations": [
        {
          "annotation_id": "WSA-visual-0001/a/0",
          "binding_ref": "VB-90",
          "form": "angle-arcs",
          "role_key": "angles",
          "resolved_targets": {
            "entity_ids": [
              "A",
              "C",
              "D"
            ],
            "angles": [
              {
                "vertex": "A",
                "ray_points": [
                  "D",
                  "C"
                ],
                "sector": "minor"
              },
              {
                "vertex": "C",
                "ray_points": [
                  "A",
                  "D"
                ],
                "sector": "minor"
              }
            ]
          },
          "version": 1,
          "owner_keys": [
            "scope-owner-1"
          ]
        }
      ],
      "focus": null,
      "digest": "sha256:0000000000000000000000000000000000000000000000000000000000000000"
    }
  },
  "solution_board": {
    "mode": "building",
    "groups": [
      {
        "group_id": "PG-01",
        "title": "建立比例",
        "entries": [
          {
            "entry_id": "BE-01",
            "kind": "statement",
            "content": "△ADE ∽ △ABC（A 字型）",
            "state": "visible"
          },
          {
            "entry_id": "BE-02",
            "kind": "derivation",
            "content": "AD/AB = DE/BC",
            "state": "active",
            "attempt_summary": "学生已写出左边比例"
          }
        ]
      }
    ],
    "fragments": [
      {
        "fragment_id": "EF-TS4242-0001",
        "kind": "approved_math_note",
        "content": "AO/DO = BO/OE（蝶形相似对应边）",
        "basis_refs": [
          "FN-20"
        ],
        "attach_to_entry": "BE-02"
      }
    ]
  },
  "participation": {
    "kind": "workspace_input",
    "gate_id": "GT-01",
    "action_id": "WSA-20260827-0001"
  }
}
